Hisse,Link,Pay Grubu,İmtiyaz Türü,Borsada işlem görüp görmediği
ACISELSAN ACIPAYAM SELÜLOZ SANAYİ VE TİCARET A.Ş.,https://www.kap.org.tr/tr/sirket-bilgileri/genel/4028e4a2420327a4014209c55161144d,-,,İşlem Görüyor
ADEL KALEMCİLİK TİCARET VE SANAYİ A.Ş.,https://www.kap.org.tr/tr/sirket-bilgileri/genel/4028e4a240e8d16e0140e8f159dc0033,-,YOKTUR,İşlem Görüyor
ADESE GAYRİMENKUL YATIRIM A.Ş.,https://www.kap.org.tr/tr/sirket-bilgileri/genel/4028e4a140f2ed720141164431b905a5,A,"A Grubu paylar Ana Sözleşme?nin 7. ve 15. maddeleri çerçevesinde Yönetim Kurulu üyelerinin belirlenmesi ve
oy hakkı kullanımında imtiyaza sahiptir. 
İmtiyazlı (Oy Hakkı 1 hisse 15 Oy)",İşlem Görmüyor
ADRA GAYRİMENKUL YATIRIM ORTAKLIĞI A.Ş.,https://www.kap.org.tr/tr/sirket-bilgileri/genel/8acae2c586d22c53018a737800f804ae,A,,İşlem Görmüyor
AFYON ÇİMENTO SANAYİ T.A.Ş.,https://www.kap.org.tr/tr/sirket-bilgileri/genel/4028e4a24158e42401415af83d607fd3,-,YOKTUR,İşlem Görüyor
AG ANADOLU GRUBU HOLDİNG A.Ş.,https://www.kap.org.tr/tr/sirket-bilgileri/genel/4028e4a240f2ef4c014101b18dc000f7,A,YOK,İşlem Görüyor
AGESA HAYAT VE EMEKLİLİK A.Ş.,https://www.kap.org.tr/tr/sirket-bilgileri/genel/4028e4a140e95bea0140edeb7a54015d,-,,Seçim Yapınız
AGROTECH YÜKSEK TEKNOLOJİ VE YATIRIM A.Ş.,https://www.kap.org.tr/tr/sirket-bilgileri/genel/8acae2c48b2fa259018bb9e449415e84,A,Yönetim kuruluna aday gösterme ve genel kurulda oy imtiyazı bulunmaktadır.,İşlem Görmüyor
AHLATCI DOĞAL GAZ DAĞITIM ENERJİ VE YATIRIM A.Ş.,https://www.kap.org.tr/tr/sirket-bilgileri/genel/4028e4a14203278a0142095715f914d0,A,İmtiyaz Var,İşlem Görmüyor
AKBANK T.A.Ş.,https://www.kap.org.tr/tr/sirket-bilgileri/genel/4028e4a240e8d1830140e905edcd0006,-,Yok,İşlem Görüyor
AKÇANSA ÇİMENTO SANAYİ VE TİCARET A.Ş.,https://www.kap.org.tr/tr/sirket-bilgileri/genel/4028e4a140e8cfa00140e92b0c380016,-,İmtiyaz Yoktur,İşlem Görüyor
AKDENİZ YATIRIM HOLDİNG A.Ş.,https://www.kap.org.tr/tr/sirket-bilgileri/genel/4028e4a1415f4d9901416dc64bd161cb,A,"Yönetim Kuruluna aday gösterme, genel kurulda oy hakkı",Seçim Yapınız
AKENERJİ ELEKTRİK ÜRETİM A.Ş.,https://www.kap.org.tr/tr/sirket-bilgileri/genel/4028e4a14184e9cf01419bffce0b5a69,-,Yok,İşlem Görüyor
AKFEN GAYRİMENKUL YATIRIM ORTAKLIĞI A.Ş.,https://www.kap.org.tr/tr/sirket-bilgileri/genel/4028e4a141733b56014183c1c6ed426e,A,Genel Kurullarda iki yönetim kurulu üyesi seçme imtiyazı vardır,İşlem Görmüyor
AKFEN YENİLENEBİLİR ENERJİ A.Ş.,https://www.kap.org.tr/tr/sirket-bilgileri/genel/8acae2c48304fe9e0186a66e7a9568ea,A,Yönetim kuruluna aday gösterme imtiyazı ve oy hakkında imtiyaz,İşlem Görmüyor
AKIN TEKSTİL A.Ş.,https://www.kap.org.tr/tr/sirket-bilgileri/genel/4028e4a140f2ed7101412c13ba8303a8,A,,İşlem Görmüyor
AKİŞ GAYRİMENKUL YATIRIM ORTAKLIĞI A.Ş.,https://www.kap.org.tr/tr/sirket-bilgileri/genel/4028e4a14158e41f01415a865c0e4d13,A,Yönetim Kuruluna aday gösterme,İşlem Görmüyor
AKMERKEZ GAYRİMENKUL YATIRIM ORTAKLIĞI A.Ş.,https://www.kap.org.tr/tr/sirket-bilgileri/genel/4028e4a240e95dc30140ecc218b30032,A,Yönetim Kuruluna 4 Aday Gösterme,İşlem Görmüyor
AKSA AKRİLİK KİMYA SANAYİİ A.Ş.,https://www.kap.org.tr/tr/sirket-bilgileri/genel/4028e4a240f2ef470141175e189f0453,-,-,İşlem Görüyor
AKSA ENERJİ ÜRETİM A.Ş.,https://www.kap.org.tr/tr/sirket-bilgileri/genel/4028e4a241733d42014179341a147ddb,A,8 kişilik Yönetim Kurulu'nun yarısı A Grubu nama yazılı pay sahiplerinin sermaye çoğunluğunun seçeceği adaylar arasından seçilir.,İşlem Görmüyor
AKSİGORTA A.Ş.,https://www.kap.org.tr/tr/sirket-bilgileri/genel/4028e4a140e95be70140ed12e1f4002c,-,,
AKSU ENERJİ VE TİCARET A.Ş.,https://www.kap.org.tr/tr/sirket-bilgileri/genel/4028e4a140f2ed7201413a20480e0851,A,15,İşlem Görmüyor
ALARKO CARRIER SANAYİ VE TİCARET A.Ş.,https://www.kap.org.tr/tr/sirket-bilgileri/genel/4028e4a241558bd9014155e085e305fd,-,-,İşlem Görüyor
ALARKO GAYRİMENKUL YATIRIM ORTAKLIĞI A.Ş.,https://www.kap.org.tr/tr/sirket-bilgileri/genel/4028e4a241462fd801415005df1c3612,A,Yönetim Kurulu Üyelerinin seçiminde 4 aday gösterme hakkı,İşlem Görmüyor
ALARKO HOLDİNG A.Ş.,https://www.kap.org.tr/tr/sirket-bilgileri/genel/4028e4a241462fd80141500c738e36be,-,-,İşlem Görüyor
ALBARAKA TÜRK KATILIM BANKASI A.Ş.,https://www.kap.org.tr/tr/sirket-bilgileri/genel/4028e4a240f2ef4c014106a1c5ef016d,-,İmtiyaz Yok,İşlem Görüyor
ALCATEL LUCENT TELETAŞ TELEKOMÜNİKASYON A.Ş.,https://www.kap.org.tr/tr/sirket-bilgileri/genel/4028e4a140f2ed71014110e38acb01b5,A-C,Yok,İşlem Görüyor
ALFA SOLAR ENERJİ SANAYİ VE TİCARET A.Ş.,https://www.kap.org.tr/tr/sirket-bilgileri/genel/8acae2c5830502c30183559e2336223e,A,Yönetim kuruluna aday gösterme ve genel kurulda oy kullanma imtiyazı,İşlem Görmüyor
ALKİM ALKALİ KİMYA A.Ş.,https://www.kap.org.tr/tr/sirket-bilgileri/genel/4028e4a140e95be70140ed147846003c,A,Genel Kurul Oy İmtiyazı,İşlem Görmüyor
ALKİM KAĞIT SANAYİ VE TİCARET A.Ş.,https://www.kap.org.tr/tr/sirket-bilgileri/genel/4028e4a2416e697d01416f39965a5eb5,A,Kar payında imtiyaz yoktur. Her hisse için 1 oy hakkı var.,İşlem Görmüyor
ALTIN YUNUS ÇEŞME TURİSTİK TESİSLER A.Ş.,https://www.kap.org.tr/tr/sirket-bilgileri/genel/4028e4a240e95dc90140ed1bc88e0071,A,Yönetim Kurulu Üye Seçimi,İşlem Görmüyor
ALTINAY SAVUNMA TEKNOLOJİLERİ A.Ş.,https://www.kap.org.tr/tr/sirket-bilgileri/genel/8acae2c58b2fa64e018f3d2d712476e2,A,Yönetim Kurulu'na Aday Gösterme ve Genel Kurulda oyda imtiyaz,İşlem Görmüyor
ALTINKILIÇ GIDA VE SÜT SANAYİ TİCARET A.Ş.,https://www.kap.org.tr/tr/sirket-bilgileri/genel/8acae2c48c3efac0018fabe7ce965048,A,yönetim kuruluna aday gösterme ve genel kurulda oy imtiyazı,İşlem Görmüyor
ALTINYAĞ MADENCİLİK VE ENERJİ YATIRIMLARI SANAYİ VE TİCARET A.Ş.,https://www.kap.org.tr/tr/sirket-bilgileri/genel/4028e4a14158e41f01415a8ea74c4fbe,-,YOK,İşlem Görüyor
ALVES KABLO SANAYİ VE TİCARET A.Ş.,https://www.kap.org.tr/tr/sirket-bilgileri/genel/8acae2c58b2fa64e018dc0263b1377aa,A,Oy hakkı imtiyazı ve yönetim kuruluna aday gösterme imtiyazı.,İşlem Görmüyor
ANADOLU ANONİM TÜRK SİGORTA ŞİRKETİ,https://www.kap.org.tr/tr/sirket-bilgileri/genel/4028e4a140e95bea0140ed21b5c10078,B,Yoktur,İşlem Görüyor
ANADOLU EFES BİRACILIK VE MALT SANAYİİ A.Ş.,https://www.kap.org.tr/tr/sirket-bilgileri/genel/4028e4a140e95bea0140ed2fde10009d,-,,İşlem Görüyor
ANADOLU HAYAT EMEKLİLİK A.Ş.,https://www.kap.org.tr/tr/sirket-bilgileri/genel/4028e4a140e95be70140ed40cb930098,A,YÖNETİM KURULU ÜYELİĞİNE ADAY GÖSTERME,İşlem Görmüyor
ANADOLU ISUZU OTOMOTİV SANAYİ VE TİCARET A.Ş.,https://www.kap.org.tr/tr/sirket-bilgileri/genel/4028e4a140e95be70140ed43c4fe00a9,A,Yönetim Kurulu Seçiminde,İşlem Görmüyor
ANATOLİA TANI VE BİYOTEKNOLOJİ ÜRÜNLERİ ARAŞTIRMA GELİŞTİRME SANAYİ VE TİCARET A.Ş.,https://www.kap.org.tr/tr/sirket-bilgileri/genel/8acae2c47afb298b017bed9f037a7185,A,"Oy Hakkı İmtiyazı, Yönetim Kurulunda Temsil Edilme İmtiyazı",İşlem Görmüyor
ANEL ELEKTRİK PROJE TAAHHÜT VE TİCARET A.Ş.,https://www.kap.org.tr/tr/sirket-bilgileri/genel/4028e4a1416e696301416ecd11a12b86,A,1) Oyda İmtiyaz 2) Bağımsız Yönetim Kurulu üyeleri dışındaki üye seçiminde aday gösterme imtiyazı,İşlem Görmüyor
ARÇELİK A.Ş.,https://www.kap.org.tr/tr/sirket-bilgileri/genel/4028e4a240e95dc90140ed55b43900cf,-,Yok,İşlem Görüyor
ARD GRUP BİLİŞİM TEKNOLOJİLERİ A.Ş.,https://www.kap.org.tr/tr/sirket-bilgileri/genel/8acae2c46d7599a6016dde9d93aa2b52,A,Yönetim Kurulu üyelerinin belirlenmesi ve Genel Kurulda oy hakkı kullanımında imtiyazı bulunmaktadır.,İşlem Görmüyor
ARENA BİLGİSAYAR SANAYİ VE TİCARET A.Ş.,https://www.kap.org.tr/tr/sirket-bilgileri/genel/4028e4a140e95bea0140ed5af3a000da,-,Yoktur.,İşlem Görüyor
ARSAN TEKSTİL TİCARET VE SANAYİ A.Ş.,https://www.kap.org.tr/tr/sirket-bilgileri/genel/4028e4a14158e41f01415b1862696142,-,YOKTUR,İşlem Görüyor
ARTEMİS HALI A.Ş.,https://www.kap.org.tr/tr/sirket-bilgileri/genel/8acae2c48c3efac0018dd4c742665c88,A,Oy İmtiyazı ve Yönetiim Kurulu Aday Gösterme İmtiyazı,İşlem Görmüyor
ARZUM ELEKTRİKLİ EV ALETLERİ SANAYİ VE TİCARET A.Ş.,https://www.kap.org.tr/tr/sirket-bilgileri/genel/4028e4a1415f4d990141600875c531b9,A,YÖNETİM KURULUNA ADAY GÖSTERME İMTİYAZI,İşlem Görmüyor
ASCE GAYRİMENKUL YATIRIM ORTAKLIĞI A.Ş.,https://www.kap.org.tr/tr/sirket-bilgileri/genel/8acae2c562329bd1016464c3796e08a0,A,İmtiyazlı,İşlem Görmüyor
ASELSAN ELEKTRONİK SANAYİ VE TİCARET A.Ş.,https://www.kap.org.tr/tr/sirket-bilgileri/genel/4028e4a1413b7ef401413bc2251e0047,A,YÖNETİM KURULUNA ADAY GÖSTERME,İşlem Görmüyor
ASTOR ENERJİ A.Ş.,https://www.kap.org.tr/tr/sirket-bilgileri/genel/8acae2c562329bd10164405fe6c17996,A,A GRUP PAYLARIN PAY BAŞINA 5 OY HAKKI İMTİYAZI VE YÖNETİM KURULU ÜYE SAYISININ YARISINI AŞMAYACAK ŞEKİLDE ADAY GÖSTERME İMTİYAZI,İşlem Görmüyor
ATA GAYRİMENKUL YATIRIM ORTAKLIĞI A.Ş.,https://www.kap.org.tr/tr/sirket-bilgileri/genel/4028e4a140e95bea0140eddf432a0115,A,Yönetim Kurulu Üyelerinin Seçiminde Aday Göstreme İmtiyazı,İşlem Görmüyor
ATAKEY PATATES GIDA SANAYİ VE TİCARET A.Ş.,https://www.kap.org.tr/tr/sirket-bilgileri/genel/8acae2c586d22c53018953500b004578,A,İmtiyazlı,İşlem Görmüyor
ATAKULE GAYRİMENKUL YATIRIM ORTAKLIĞI A.Ş.,https://www.kap.org.tr/tr/sirket-bilgileri/genel/4028e4a240f2ef4c0141164a06d8043a,A,YÖNETİM KURULU ADAY GÖSTERME İMTİYAZI BULUNMAKTADIR.,İşlem Görmüyor
ATLANTİS YATIRIM HOLDİNG A.Ş.,https://www.kap.org.tr/tr/sirket-bilgileri/genel/4028e4a241558bd9014155dde60a05e7,A,Yönetim Kuruluna Aday Göstermede İmtiyaz,İşlem Görmüyor
ATLAS MENKUL KIYMETLER YATIRIM ORTAKLIĞI A.Ş.,https://www.kap.org.tr/tr/sirket-bilgileri/genel/4028e4a240f2ef4c0141029fff920169,A,Yönetim Kurulu Üyelerinin seçiminde (A) Grubu paylarının her biri 100.000.000 (Yüzmilyon) oy hakkına sahiptir,İşlem Görmüyor
ATP YAZILIM VE TEKNOLOJİ A.Ş.,https://www.kap.org.tr/tr/sirket-bilgileri/genel/8acae2c4794d364801798f781baf0fad,A,"Her bir A Grubu payın, genel kurul toplantılarında 5 oy hakkı vardır. Şirket yönetim kurulu üyelerinin yarısı A grubu pay sahiplerinin belirlediği adaylar arasından seçilmektedir.",İşlem Görmüyor
A.V.O.D. KURUTULMUŞ GIDA VE TARIM ÜRÜNLERİ SANAYİ TİCARET A.Ş.,https://www.kap.org.tr/tr/sirket-bilgileri/genel/4028e4a140f2ed72014107916fed023d,A,Oy imtiyazı 1 pay =15 oy,İşlem Görmüyor
AVRASYA GAYRİMENKUL YATIRIM ORTAKLIĞI A.Ş.,https://www.kap.org.tr/tr/sirket-bilgileri/genel/4028e4a240f2ef4c0141029cf7680164,A,(A) grubu payların yönetim kurulu üyelerinin seçiminde aday gösterme imtiyazı vardır. Yönetim kurulu üyelerinin 3 adedi (A) Grubu pay sahiplerinin çoğunlukla gösterdiği adaylar arasından seçilir,İşlem Görmüyor
AVRASYA PETROL VE TURİSTİK TESİSLER YATIRIMLAR A.Ş.,https://www.kap.org.tr/tr/sirket-bilgileri/genel/4028e4a241733d42014182b942a247e4,A,Yönetim kurulu üyelerinin en fazla yarısı A Grubu pay sahiplerinin göstereceği adaylar arasından genel kurulca seçilir.Yönetim Kurulu 5 üyeden teşekkül ederse 2?si; 7 üyeden teşekkül ederse 3?ü; 9 üyeden teşekkül ederse 4?üA Grubu pay sahiplerinin göstereceği adaylar arasından genel kurulca seçilir.,İşlem Görmüyor
AVRUPA YATIRIM HOLDİNG A.Ş.,https://www.kap.org.tr/tr/sirket-bilgileri/genel/1DE05DAA81E9073AE0530A4A622A2EBD,A,İmtiyazlı (Yönetim Kurulu Seçer),İşlem Görmüyor
AVRUPAKENT GAYRİMENKUL YATIRIM ORTAKLIĞI A.Ş.,https://www.kap.org.tr/tr/sirket-bilgileri/genel/8acae2c48c3efabf018c4824da4a0623,A,,
AYDEM YENİLENEBİLİR ENERJİ A.Ş.,https://www.kap.org.tr/tr/sirket-bilgileri/genel/8acae2c4782a4d580178b56e7c5c4404,A,,İşlem Görmüyor
AYEN ENERJİ A.Ş.,https://www.kap.org.tr/tr/sirket-bilgileri/genel/4028e4a240e95dc90140edf072ef0165,A,13-c.13-d,İşlem Görmüyor
AYES ÇELİK HASIR VE ÇİT SANAYİ A.Ş.,https://www.kap.org.tr/tr/sirket-bilgileri/genel/4028e4a1416f846101416f85f6730028,-,Yoktur,İşlem Görüyor
AYGAZ A.Ş.,https://www.kap.org.tr/tr/sirket-bilgileri/genel/4028e4a140e95be70140ee03bd6000e0,-,Yok,İşlem Görüyor
AZTEK TEKNOLOJİ ÜRÜNLERİ TİCARET A.Ş.,https://www.kap.org.tr/tr/sirket-bilgileri/genel/8acae2c4819d0efe01826e96dd896e0e,A,"Yönetim Kurulu Aday Gösterme,Kar Payı,Oy",İşlem Görmüyor
A1 CAPITAL YATIRIM MENKUL DEĞERLER A.Ş.,https://www.kap.org.tr/tr/sirket-bilgileri/genel/4028e4a1416e696301416f37201c5f2e,A,Aday Gösterme İmtiyazı / Oy Hakkı,İşlem Görmüyor
BAGFAŞ BANDIRMA GÜBRE FABRİKALARI A.Ş.,https://www.kap.org.tr/tr/sirket-bilgileri/genel/4028e4a240f2ef4701410810f53601c4,A,A grubu paylar oya iştirak bakımından imtiyazlıdır. A grubu pay sahipleri Genel Kurul toplantılarında her A grubu pay için ayrıca 10 oy hakkına sahiptirler. Böylelikle her imtiyazlı A grubu payın 11 oyu vardır,İşlem Görmüyor
BAK AMBALAJ SANAYİ VE TİCARET A.Ş.,https://www.kap.org.tr/tr/sirket-bilgileri/genel/4028e4a1415f4d9b01415fdc75f12f64,A,,İşlem Görmüyor
BALATACILAR BALATACILIK SANAYİ VE TİCARET A.Ş.,https://www.kap.org.tr/tr/sirket-bilgileri/genel/4028e4a1416e696501416ee5a3d939ad,-,YOKTUR,İşlem Görüyor
BANTAŞ BANDIRMA AMBALAJ SANAYİ TİCARET A.Ş.,https://www.kap.org.tr/tr/sirket-bilgileri/genel/402821824da3aa9b014ef2c4cda22947,A,5.625.000 ADEDİ İÇİN - YÖNETİM KURULU ÜYELERİNİN YARISININ SEÇİMİNDE ADAY GÖSTERME İMTİYAZI,İşlem Görmüyor
BANVİT BANDIRMA VİTAMİNLİ YEM SANAYİİ A.Ş.,https://www.kap.org.tr/tr/sirket-bilgileri/genel/4028e4a1415f4d990141601902e33250,-,,İşlem Görüyor
BAREM AMBALAJ SANAYİ VE TİCARET A.Ş.,https://www.kap.org.tr/tr/sirket-bilgileri/genel/8acae2c47f7cb491017fb5f0afdf174a,A,Yönetim Kurulu Üye Seçiminde İmtiyaz ve Oy Hakkı İmtiyazı,İşlem Görmüyor
BAŞKENT DOĞALGAZ DAĞITIM GAYRİMENKUL YATIRIM ORTAKLIĞI A.Ş.,https://www.kap.org.tr/tr/sirket-bilgileri/genel/4028e4a240f2ef4701413a3410a605ce,A,ADAY GÖSTERME,İşlem Görmüyor
BAŞTAŞ BAŞKENT ÇİMENTO SANAYİ VE TİCARET A.Ş.,https://www.kap.org.tr/tr/sirket-bilgileri/genel/4028e4a140f2ed7201413a4092720892,-,,
BATI EGE GAYRİMENKUL YATIRIM ORTAKLIĞI A.Ş.,https://www.kap.org.tr/tr/sirket-bilgileri/genel/8acae2c48b2fa25a018c01ae7c3973de,A,Yönetim Kurulu Seçimi,İşlem Görmüyor
BATIÇİM BATI ANADOLU ÇİMENTO SANAYİİ A.Ş.,https://www.kap.org.tr/tr/sirket-bilgileri/genel/4028e4a140e95be70140ee07044700eb,A,"Yönetim Kurulu üye seçiminde, oy hakkında ve kar payında imtiyaz",İşlem Görmüyor
BATISÖKE SÖKE ÇİMENTO SANAYİİ T.A.Ş.,https://www.kap.org.tr/tr/sirket-bilgileri/genel/4028e4a24158e42401415920fc3308c5,A,YÖNETİM KURULUNDA ÜYE SEÇİMİNDE İMTİYAZ,İşlem Görmüyor
BAYDÖNER RESTORANLARI A.Ş.,https://www.kap.org.tr/tr/sirket-bilgileri/genel/8acae2c586d22c510189de64baa92725,A,Oyda İmtiyaz,İşlem Görmüyor
BAYRAK EBT TABAN SANAYİ VE TİCARET A.Ş.,https://www.kap.org.tr/tr/sirket-bilgileri/genel/8acae2c56faf888c0170a0e2d88d77c3,A,Yönetim Kurulu Üye Seçimi Ve Beheri 5 oy Hakkı,İşlem Görmüyor
BERA HOLDİNG A.Ş.,https://www.kap.org.tr/tr/sirket-bilgileri/genel/4028e4a241733d42014174023cb0192b,-,,
BERKOSAN YALITIM VE TECRİT MADDELERİ ÜRETİM VE TİCARET A.Ş.,https://www.kap.org.tr/tr/sirket-bilgileri/genel/4028e4a1413b7ef4014144cf3f7b0075,A,imtiyaz,İşlem Görmüyor
BEŞİKTAŞ FUTBOL YATIRIMLARI SANAYİ VE TİCARET A.Ş.,https://www.kap.org.tr/tr/sirket-bilgileri/genel/4028e4a241a25fcb0141a276cda10189,A,Yönetim Kurulu Üyelerinin seçimi,İşlem Görmüyor
BEYAZ FİLO OTO KİRALAMA A.Ş.,https://www.kap.org.tr/tr/sirket-bilgileri/genel/4028e4a141558bdd01415619e62c0577,A,Yönetim Kurulu aday seçiminde imtiyaz,İşlem Görmüyor
BİEN YAPI ÜRÜNLERİ SANAYİ TURİZM VE TİCARET A.Ş.,https://www.kap.org.tr/tr/sirket-bilgileri/genel/4028e4a24a5df6e7014ba1e60b464173,A,İmtiyazlı,İşlem Görmüyor
BİLİCİ YATIRIM SANAYİ VE TİCARET A.Ş.,https://www.kap.org.tr/tr/sirket-bilgileri/genel/4028e4a2413b80d1014144caf7b90037,A,Yönetim Kuruluna ve Denetim Kuruluna Aday Gösterme İmtiyazı ile Oy Hakkı İmtiyazı,İşlem Görmüyor
BİM BİRLEŞİK MAĞAZALAR A.Ş.,https://www.kap.org.tr/tr/sirket-bilgileri/genel/4028e4a140e95be70140ee1b7b030119,-,Yoktur,İşlem Görüyor
BİOTREND ÇEVRE VE ENERJİ YATIRIMLARI A.Ş.,https://www.kap.org.tr/tr/sirket-bilgileri/genel/8acae2c4780814e2017826e1e07318d8,-,Yoktur,İşlem Görüyor
BİRİKİM VARLIK YÖNETİM A.Ş.,https://www.kap.org.tr/tr/sirket-bilgileri/genel/8acae2c562329bd10162b9ff7a6b53d6,-,,
BİRKO BİRLEŞİK KOYUNLULULAR MENSUCAT TİCARET VE SANAYİ A.Ş.,https://www.kap.org.tr/tr/sirket-bilgileri/genel/4028e4a240e95dc90140ee21c40601aa,-,,İşlem Görüyor
BİRLEŞİM MÜHENDİSLİK ISITMA SOĞUTMA HAVALANDIRMA SANAYİ VE TİCARET A.Ş.,https://www.kap.org.tr/tr/sirket-bilgileri/genel/8acae2c4794d3648017aa01a43690c1f,A,Yönetim Kuruluna aday gösterme,İşlem Görmüyor
BİRLİK MENSUCAT TİCARET VE SANAYİ İŞLETMESİ A.Ş.,https://www.kap.org.tr/tr/sirket-bilgileri/genel/4028e4a240e95dc90140ee243b5b01ba,-,YOK,İşlem Görüyor
BİZİM TOPTAN SATIŞ MAĞAZALARI A.Ş.,https://www.kap.org.tr/tr/sirket-bilgileri/genel/4028e4a1416e696301416ec4471d280d,-,Yoktur,İşlem Görüyor
BMS BİRLEŞİK METAL SANAYİ VE TİCARET A.Ş.,https://www.kap.org.tr/tr/sirket-bilgileri/genel/8acae2c47f7cb49201802bda6cbf6b77,A,İMTİYAZLI,İşlem Görmüyor
BMS ÇELİK HASIR SANAYİ VE TİCARET A.Ş.,https://www.kap.org.tr/tr/sirket-bilgileri/genel/8acae2c56eccfc0c016f18f5b1e21747,A,İMTİYAZLI,İşlem Görmüyor
BOĞAZİÇİ BETON SANAYİ VE TİCARET A.Ş.,https://www.kap.org.tr/tr/sirket-bilgileri/genel/8acae2c4782a4d560178d45481dc5948,-,Bulunmamaktadır,İşlem Görüyor
BOR ŞEKER A.Ş.,https://www.kap.org.tr/tr/sirket-bilgileri/genel/8acae2c58b2fa64e018d63bcd2684e71,A,,İşlem Görmüyor
BORLEASE OTOMOTİV A.Ş.,https://www.kap.org.tr/tr/sirket-bilgileri/genel/8acae2c486d22a3a018b03b5cfbe29b8,A,Yönetim Kuruluna Aday Gösterme ve Genel Kurulda Oy İmtiyazı,İşlem Görmüyor
BORUSAN BİRLEŞİK BORU FABRİKALARI SANAYİ VE TİCARET A.Ş.,https://www.kap.org.tr/tr/sirket-bilgileri/genel/4028e4a140f2ed7201412ac9ca5d06e6,A,"Şirket Esas Sözleşmesinin Yönetim Kurulu?nun Oluşumu başlıklı 10. maddesi uyarınca, Yönetim Kurulu Üyeleri?nin yarısı (A) grubu hissedarların göstereceği adaylar arasından seçilir.
Şirket Esas Sözleşmesinin Oy Hakkı başlıklı 20. maddesi uyarınca, A Grubu hisselerin olağan ve olağanüstü genel kurul toplantılarında beşer oy hakkı vardır.",İşlem Görmüyor
BORUSAN YATIRIM VE PAZARLAMA A.Ş.,https://www.kap.org.tr/tr/sirket-bilgileri/genel/4028e4a1415f4d9b0141603cd3904103,A,YK seçimi imtiyazı,İşlem Görmüyor
BOSCH FREN SİSTEMLERİ SANAYİ VE TİCARET A.Ş.,https://www.kap.org.tr/tr/sirket-bilgileri/genel/4028e4a140e95bea0140ee30fb6001b9,A,Yönetim Kuruluna aday gösterme imtiyazına sahiptir.,İşlem Görmüyor
BOSSA TİCARET VE SANAYİ İŞLETMELERİ T.A.Ş.,https://www.kap.org.tr/tr/sirket-bilgileri/genel/4028e4a1415f4d9b014160053ed13d39,-,Yoktur,İşlem Görüyor
BRİSA BRIDGESTONE SABANCI LASTİK SANAYİ VE TİCARET A.Ş.,https://www.kap.org.tr/tr/sirket-bilgileri/genel/4028e4a140e95bea0140ee33bff201cd,A,Yok,İşlem Görmüyor
BURÇELİK BURSA ÇELİK DÖKÜM SANAYİİ A.Ş.,https://www.kap.org.tr/tr/sirket-bilgileri/genel/4028e4a14158e41e01415b2636586ca7,-,Yok,İşlem Görüyor
BURÇELİK VANA SANAYİ VE TİCARET A.Ş.,https://www.kap.org.tr/tr/sirket-bilgileri/genel/4028e4a14158e41e01415b2789266cb6,-,Yok,İşlem Görüyor
BURSA ÇİMENTO FABRİKASI A.Ş.,https://www.kap.org.tr/tr/sirket-bilgileri/genel/4028e4a140ee35c00140ee41a5e4000f,-,Yok,İşlem Görüyor
BÜLBÜLOĞLU VİNÇ SANAYİ VE TİCARET A.Ş.,https://www.kap.org.tr/tr/sirket-bilgileri/genel/8acae2c5830502c30185dea8694c5722,A,Yönetim Kurulu Üye Seçiminde Aday Gösterme ve Oyda İmtiyaz,İşlem Görmüyor
BÜYÜK ŞEFLER GIDA TURİZM TEKSTİL DANIŞMANLIK ORGANİZASYON EĞİTİM SANAYİ VE TİCARET A.Ş.,https://www.kap.org.tr/tr/sirket-bilgileri/genel/8acae2c486d22a3a0187c6822e7324e6,A,"Yönetim Kurulu'na aday gösterme imtiyazı, A grubu paylar bakımından rüçhan hakkı kullanımında imtiyaz, özellikli genel kurul kararlarına ilişkin imtiyaz ve Genel Kurul toplantılarında oyda imtiyaz",İşlem Görmüyor
CARREFOURSA CARREFOUR SABANCI TİCARET MERKEZİ A.Ş.,https://www.kap.org.tr/tr/sirket-bilgileri/genel/4028e4a140ee35c00140ee56930f0024,-,-,İşlem Görüyor
CASA EMTİA PETROL KİMYEVİ VE TÜREVLERİ SANAYİ TİCARET A.Ş.,https://www.kap.org.tr/tr/sirket-bilgileri/genel/4028e4a240f2ef4c01413acf8cda06cc,-,Yoktur,İşlem Görüyor
CEO EVENT MEDYA A.Ş.,https://www.kap.org.tr/tr/sirket-bilgileri/genel/8acae2c469cee2a20169ed8afa9112ee,A,,
COCA-COLA İÇECEK A.Ş.,https://www.kap.org.tr/tr/sirket-bilgileri/genel/4028e4a140ee35c00140ee586bdd0034,A,Yönetime katılmada imtiyaz,İşlem Görmüyor
CONSUS ENERJİ İŞLETMECİLİĞİ VE HİZMETLERİ A.Ş.,https://www.kap.org.tr/tr/sirket-bilgileri/genel/8acae2c57f7cbb48018007c3ad6154d4,-,İmtiyazsız,İşlem Görüyor
COSMOS YATIRIM HOLDİNG A.Ş.,https://www.kap.org.tr/tr/sirket-bilgileri/genel/4028e4a24158e42401415ada104f7e44,A,İMTİYAZLI,İşlem Görmüyor
CREDITWEST FAKTORİNG A.Ş.,https://www.kap.org.tr/tr/sirket-bilgileri/genel/4028e4a141558bdd0141561c84700589,A,YÖNETİM KURULU ÜYELERİNİN YARIDAN BİR FAZLASINI SEÇME HAKKI,İşlem Görmüyor
CVK MADEN İŞLETMELERİ SANAYİ VE TİCARET A.Ş.,https://www.kap.org.tr/tr/sirket-bilgileri/genel/8acae2c586d22c510187381ba299429a,A,,İşlem Görmüyor
CW ENERJİ MÜHENDİSLİK TİCARET VE SANAYİ A.Ş.,https://www.kap.org.tr/tr/sirket-bilgileri/genel/8acae2c56faf888c016fd6c2036e0a5d,A,Yönetim kuruluna aday gösterme ve genel kurulda 1'e 5 oy imtiyazı vardır.,İşlem Görmüyor
ÇAN2 TERMİK A.Ş.,https://www.kap.org.tr/tr/sirket-bilgileri/genel/8acae2c578080f31017811f4dca6032d,-,-,Seçim Yapınız
ÇATES ELEKTRİK ÜRETİM A.Ş.,https://www.kap.org.tr/tr/sirket-bilgileri/genel/8acae2c58b2fa64e018bfaefef6b6fcd,A,,İşlem Görmüyor
ÇELEBİ HAVA SERVİSİ A.Ş.,https://www.kap.org.tr/tr/sirket-bilgileri/genel/4028e4a140ee84900140f1f1584c0015,A,Yönetim Kurulu ve Denetim Kurulu'na aday gösterme,İşlem Görmüyor
ÇELİK HALAT VE TEL SANAYİİ A.Ş.,https://www.kap.org.tr/tr/sirket-bilgileri/genel/4028e4a240f2ef4c0141164dd92d044c,-,Yoktur,İşlem Görüyor
ÇEMAŞ DÖKÜM SANAYİ A.Ş.,https://www.kap.org.tr/tr/sirket-bilgileri/genel/4028e4a140f2ed7201413b14392508fb,-,Yoktur,İşlem Görüyor
ÇEMTAŞ ÇELİK MAKİNA SANAYİ VE TİCARET A.Ş.,https://www.kap.org.tr/tr/sirket-bilgileri/genel/4028e4a140ee84900140f1f334ce0025,-,YOK,İşlem Görüyor
ÇİMBETON HAZIRBETON VE PREFABRİK YAPI ELEMANLARI SANAYİ VE TİCARET A.Ş.,https://www.kap.org.tr/tr/sirket-bilgileri/genel/4028e4a24158e42401415ad0dece7d3a,A,Herbir hisse sahibine 15 oy hakkı,İşlem Görmüyor
ÇİMENTAŞ İZMİR ÇİMENTO FABRİKASI T.A.Ş.,https://www.kap.org.tr/tr/sirket-bilgileri/genel/4028e4a24158e42401415ad34c7f7db7,-,,İşlem Görüyor
ÇİMSA ÇİMENTO SANAYİ VE TİCARET A.Ş.,https://www.kap.org.tr/tr/sirket-bilgileri/genel/4028e4a240ee866c0140f1f64bdb0014,-,,İşlem Görüyor
ÇUHADAROĞLU METAL SANAYİ VE PAZARLAMA A.Ş.,https://www.kap.org.tr/tr/sirket-bilgileri/genel/8acae2c552495f6401529d6a45d10598,A,Yönetim Kurulu Üyelerinin Belirlenmesi ve Oy Hakkı Kullanım imtiyazı,İşlem Görmüyor
DAGİ GİYİM SANAYİ VE TİCARET A.Ş.,https://www.kap.org.tr/tr/sirket-bilgileri/genel/4028e4a140f2ed7101411160c8c6020f,A,"Yönetim kuruluna aday göstermede imtiyaz.
Kar dağıtımında imtiyaz. 
İhraççının esas sözleşmenin 18. Maddesine göre; Şirketin iflastan başka bir sebepten infisahı veya tasfiyesi halinde, Şirket borçları ödendikten sonra kalan mevcudun %15?i (A) grubu pay sahiplerine ödenir.",İşlem Görmüyor
DAGİ YATIRIM HOLDİNG A.Ş.,https://www.kap.org.tr/tr/sirket-bilgileri/genel/4028e4a140f2ed7101411163985a021e,-,Yoktur,İşlem Görüyor
DAP GAYRİMENKUL GELİŞTİRME A.Ş.,https://www.kap.org.tr/tr/sirket-bilgileri/genel/8acae2c47d3bee4e017ea0492b6a0595,A,İmtiyaz Var,İşlem Görmüyor
DARDANEL ÖNENTAŞ GIDA SANAYİ A.Ş.,https://www.kap.org.tr/tr/sirket-bilgileri/genel/4028e4a144a0804e014521a6ca1c0705,-,YOK,İşlem Görüyor
DATAGATE BİLGİSAYAR MALZEMELERİ TİCARET A.Ş.,https://www.kap.org.tr/tr/sirket-bilgileri/genel/4028e4a2416e697d01416eabc02d14f8,A,Yönetim Kurulu Üye Seçiminde İmtiyaz,İşlem Görmüyor
DEMİSAŞ DÖKÜM EMAYE MAMÜLLERİ SANAYİ A.Ş.,https://www.kap.org.tr/tr/sirket-bilgileri/genel/4028e4a240f2ef4c0140f326817e0041,-,Yok,İşlem Görüyor
DENGE YATIRIM HOLDİNG A.Ş.,https://www.kap.org.tr/tr/sirket-bilgileri/genel/4028e4a240ee866c0140f1f80b55002b,A,İmtiyazlı,İşlem Görmüyor
DENİZ GAYRİMENKUL YATIRIM ORTAKLIĞI A.Ş.,https://www.kap.org.tr/tr/sirket-bilgileri/genel/4028e4a240ee866c0140f1fad94e0047,A,Yönetim Kurulu Üyelerinin seçiminde aday gösterme imtiyazı,İşlem Görmüyor
DERİMOD KONFEKSİYON AYAKKABI DERİ SANAYİ VE TİCARET A.Ş.,https://www.kap.org.tr/tr/sirket-bilgileri/genel/4028e4a140f2ed710141116818390237,-,İmtiyazsız,İşlem Görüyor
DERLÜKS YATIRIM HOLDİNG A.Ş.,https://www.kap.org.tr/tr/sirket-bilgileri/genel/8acae2c469cee2a4016a5492160c43c3,-,Yoktur,İşlem Görüyor
DESA DERİ SANAYİ VE TİCARET A.Ş.,https://www.kap.org.tr/tr/sirket-bilgileri/genel/4028e4a240ee866c0140f1fe48fa0070,A,,İşlem Görmüyor
